{
  "schema_version": 1,
  "snapshot": "2026-10-23",
  "updated": "2026-10-26 08:06 北京时间",
  "note": "五个方向仍在。主题、原帖和博主从 2026-10-23 起重新收录。没有素材的主题不写入本文件。",
  "tracks": [
    {
      "id": "make",
      "name": "造物",
      "tagline": "用 AI 做出能摸得着的硬件"
    },
    {
      "id": "create",
      "name": "内容创作",
      "tagline": "视频、音乐、播客的 AI 生产线"
    },
    {
      "id": "build",
      "name": "开发提效",
      "tagline": "Agent、Skills 与工程化工作流"
    },
    {
      "id": "knowledge",
      "name": "知识管理",
      "tagline": "把信息流变成自己的知识库"
    },
    {
      "id": "business",
      "name": "商业化",
      "tagline": "AI 项目怎么变成收入"
    }
  ],
  "topics": [
    {
      "slug": "hands-on",
      "name": "跟着做",
      "track": "build",
      "summary": "把能照着做的步骤收在一处，下次遇到同类问题时可以直接翻出来。",
      "audience": "想自己动手试一遍的人",
      "tools": [],
      "playbook": [],
      "pitfalls": [
        "动手前对照原文核对命令、授权和费用。"
      ],
      "status": "active",
      "source_count": 6,
      "creator_count": 3,
      "has_bookmarks": false,
      "demand_samples": 0,
      "unverified_practice": 6,
      "verified_practice": 0,
      "demand_refreshed_at": "2026-10-23 08:00 北京时间",
      "latest": "2026-10-25"
    }
  ],
  "sources": [
    {
      "id": "prac-20261024-6d6218870fce",
      "url": "https://x.com/vista8/status/2113997354655465727",
      "author": "vista8",
      "topic": "hands-on",
      "type": "教程",
      "title": "旧 Kindle 越狱后装 KOReader：当微信读书与 Obsidian 阅读器",
      "excerpt": "越狱后的旧 Kindle 续航久、成本低；装 KOReader（开源阅读器）加微信读书插件，再从 Obsidian（笔记软件）一键推书。",
      "date": "2026-10-24",
      "origin": "practice",
      "verified": false
    },
    {
      "id": "prac-20261025-e3bea54d075a",
      "url": "https://x.com/vista8/status/2114354864088297475",
      "author": "vista8",
      "topic": "hands-on",
      "type": "教程",
      "title": "不少朋友感兴趣，写个极简版的 Kindle 越狱改造教程",
      "excerpt": "京东到家买一个绿联的 type-c 转 micro-usb 线，好像20 多块，一小时送到家",
      "date": "2026-10-25",
      "origin": "practice",
      "verified": false
    },
    {
      "id": "prac-20261025-2a19b4f68001",
      "url": "https://x.com/vista8/status/2114352058577117439",
      "author": "vista8",
      "topic": "hands-on",
      "type": "教程",
      "title": "没想到开发挺顺利，搞好了",
      "excerpt": "京东到家买一个绿联的 type-c 转 micro-usb 线，好像20 多块，一小时送到家",
      "date": "2026-10-25",
      "origin": "practice",
      "verified": false
    },
    {
      "id": "prac-20261025-c08d81155c53",
      "url": "https://x.com/vista8/status/2114340452870836238",
      "author": "vista8",
      "topic": "hands-on",
      "type": "教程",
      "title": "跟大家同步下 Kindle 刷机改造进展",
      "excerpt": "更方便美观的排版设置",
      "date": "2026-10-25",
      "origin": "practice",
      "verified": false
    },
    {
      "id": "prac-20261025-d2980f2b60db",
      "url": "https://x.com/realydt/status/2114186078076936344",
      "author": "realydt",
      "topic": "hands-on",
      "type": "教程",
      "title": "Agent 把你的密钥带进模型请求，可能只需要读一遍 .env",
      "excerpt": "Codex 干活时会读配置和日志",
      "date": "2026-10-25",
      "origin": "practice",
      "verified": false
    },
    {
      "id": "prac-20261025-a2c7b1a99bef",
      "url": "https://x.com/0xlangeai/status/2114381226530472425",
      "author": "0xlangeai",
      "topic": "hands-on",
      "type": "教程",
      "title": "用 Syncthing 给云电脑做单向实时备份",
      "excerpt": "云电脑被回滚或误删时，本机仍有完整副本；用开源 Syncthing 做单向同步，约二十分钟可配好，误删还能从版本历史里捞回。",
      "date": "2026-10-25",
      "origin": "practice",
      "verified": false
    }
  ],
  "creators": [
    {
      "handle": "vista8",
      "name": "vista8",
      "focus": "",
      "source_count": 4,
      "bookmarks": 0,
      "bookmark_metric": false,
      "topics": [
        "hands-on"
      ],
      "profile_url": "https://x.com/vista8"
    },
    {
      "handle": "0xlangeai",
      "name": "0xlangeai",
      "focus": "",
      "source_count": 1,
      "bookmarks": 0,
      "bookmark_metric": false,
      "topics": [
        "hands-on"
      ],
      "profile_url": "https://x.com/0xlangeai"
    },
    {
      "handle": "realydt",
      "name": "realydt",
      "focus": "",
      "source_count": 1,
      "bookmarks": 0,
      "bookmark_metric": false,
      "topics": [
        "hands-on"
      ],
      "profile_url": "https://x.com/realydt"
    }
  ],
  "demand_refreshed_at": "2026-10-23 08:00 北京时间",
  "demand_refreshed_at_utc": "2026-10-23T00:00:00Z",
  "demand_formula": "(bookmarks+3)/(likes+5)，再按样本数向先验收缩"
}
